[
  {
    "id": "crypto.token",
    "word": "TOKEN",
    "normalizedWord": "token",
    "world": "crypto",
    "category": "digital_assets",
    "difficulty": "beginner",
    "definition": "A digital unit that represents value, access, ownership, or voting rights in a blockchain project.",
    "pronunciation": "TOH-kuhn",
    "realLifeExample": "A game might issue a token for buying items, while a DeFi service may issue one that lets holders vote on changes.",
    "didYouKnow": "Not every token is money. Some act like tickets, membership passes, receipts, or voting ballots.",
    "commonMistake": "Assuming every token has lasting value. Its price and usefulness depend on the project, demand, rules, and risks behind it.",
    "quickChallenge": {
      "id": "crypto.token.example",
      "type": "identify_best_example",
      "prompt": "Which is the clearest example of a token?",
      "options": [
        "A digital pass that grants access to a blockchain game",
        "The password to your email account",
        "A paper receipt from a grocery store"
      ],
      "correctAnswer": 0,
      "explanation": "A blockchain-based digital pass can be a token because it represents access recorded on a blockchain.",
      "difficulty": "beginner",
      "relatedTermId": "crypto.coin"
    },
    "relatedTermIds": [
      "crypto.coin",
      "crypto.mint",
      "crypto.burn"
    ],
    "xpValue": 10,
    "reviewWeight": 1
  },
  {
    "id": "crypto.node",
    "word": "NODE",
    "normalizedWord": "node",
    "world": "crypto",
    "category": "network_infrastructure",
    "difficulty": "beginner",
    "definition": "A computer connected to a blockchain network that stores, checks, or shares network data.",
    "pronunciation": "NOHD",
    "realLifeExample": "When you submit a crypto transaction, nodes relay it across the network and check that it follows the blockchain's rules.",
    "didYouKnow": "Many blockchains have thousands of independently operated nodes, reducing reliance on one central computer.",
    "commonMistake": "Thinking every node creates new coins. Many nodes only verify and share data; mining or validating is a separate role.",
    "quickChallenge": {
      "id": "crypto.node.role",
      "type": "scenario_choice",
      "prompt": "A computer checks transactions and shares valid blocks with peers. What role is it performing?",
      "options": [
        "Acting as a node",
        "Minting a collectible",
        "Setting the token's market price"
      ],
      "correctAnswer": 0,
      "explanation": "Checking and relaying blockchain data are core node functions.",
      "difficulty": "beginner",
      "relatedTermId": "crypto.peer"
    },
    "relatedTermIds": [
      "crypto.peer",
      "crypto.chain",
      "crypto.miner"
    ],
    "xpValue": 8,
    "reviewWeight": 1
  },
  {
    "id": "crypto.coin",
    "word": "COIN",
    "normalizedWord": "coin",
    "world": "crypto",
    "category": "digital_assets",
    "difficulty": "beginner",
    "definition": "A digital asset native to its own blockchain, often used to pay network fees or transfer value.",
    "pronunciation": "KOYN",
    "realLifeExample": "ETH is the native coin used to pay transaction fees on Ethereum, even when you are moving a different token.",
    "didYouKnow": "A coin runs on its own blockchain; a token is generally created on top of an existing blockchain.",
    "commonMistake": "Using coin and token as exact synonyms. The distinction matters when identifying which network secures the asset and charges its fees.",
    "quickChallenge": {
      "id": "crypto.coin.compare",
      "type": "compare_choices",
      "prompt": "Which statement best distinguishes a coin from a token?",
      "options": [
        "A coin is native to its blockchain; a token usually runs on another blockchain",
        "A coin always has a fixed price",
        "A token can never be transferred"
      ],
      "correctAnswer": 0,
      "explanation": "The native-blockchain relationship is the useful distinction; price and transfer rules vary by asset.",
      "difficulty": "beginner",
      "relatedTermId": "crypto.token"
    },
    "relatedTermIds": [
      "crypto.token",
      "crypto.gas",
      "crypto.chain"
    ],
    "xpValue": 8,
    "reviewWeight": 1
  },
  {
    "id": "crypto.mint",
    "word": "MINT",
    "normalizedWord": "mint",
    "world": "crypto",
    "category": "token_mechanics",
    "difficulty": "beginner",
    "definition": "To create new coins or tokens according to a blockchain or smart contract's rules.",
    "pronunciation": "MINT",
    "realLifeExample": "An artist may mint an NFT, causing a new token and its ownership record to be created on a blockchain.",
    "didYouKnow": "Minting can be automatic, scheduled, or restricted to approved addresses depending on the asset's code.",
    "commonMistake": "Believing minting creates value by itself. Increasing supply without matching demand can reduce the value of existing units.",
    "quickChallenge": {
      "id": "crypto.mint.supply",
      "type": "true_false",
      "prompt": "True or false: Minting always makes existing tokens more valuable.",
      "options": [
        "False",
        "True"
      ],
      "correctAnswer": 0,
      "explanation": "Minting increases supply; it does not guarantee demand or value and can dilute existing holders.",
      "difficulty": "beginner",
      "relatedTermId": "crypto.burn"
    },
    "relatedTermIds": [
      "crypto.burn",
      "crypto.token",
      "crypto.coin"
    ],
    "xpValue": 8,
    "reviewWeight": 1
  },
  {
    "id": "crypto.pool",
    "word": "POOL",
    "normalizedWord": "pool",
    "world": "crypto",
    "category": "defi",
    "difficulty": "beginner",
    "definition": "A shared collection of tokens that a DeFi protocol uses for trading, lending, or other services.",
    "pronunciation": "POOL",
    "realLifeExample": "A trader swaps ETH for another token using assets supplied by people who deposited both tokens into a liquidity pool.",
    "didYouKnow": "Pool depositors may earn fees, but the value of what they withdraw can differ from simply holding the tokens.",
    "commonMistake": "Treating pool returns as guaranteed interest. Smart-contract failure, token price changes, and impermanent loss can reduce returns.",
    "quickChallenge": {
      "id": "crypto.pool.risk",
      "type": "scenario_choice",
      "prompt": "Maya deposits two tokens into a trading pool. What should she understand first?",
      "options": [
        "Fees and token-price changes can affect her result",
        "Her return is guaranteed by the blockchain",
        "The tokens can no longer change price"
      ],
      "correctAnswer": 0,
      "explanation": "Pool returns depend on fees, market movement, contract safety, and the pool's design; they are not guaranteed.",
      "difficulty": "beginner",
      "relatedTermId": "crypto.swap"
    },
    "relatedTermIds": [
      "crypto.swap",
      "crypto.yield",
      "crypto.vault"
    ],
    "xpValue": 10,
    "reviewWeight": 1.1
  },
  {
    "id": "crypto.lock",
    "word": "LOCK",
    "normalizedWord": "lock",
    "world": "crypto",
    "category": "token_mechanics",
    "difficulty": "beginner",
    "definition": "To restrict tokens from being transferred or withdrawn for a set time or until conditions are met.",
    "pronunciation": "LOK",
    "realLifeExample": "A protocol may require users to lock governance tokens for three months before receiving voting power or rewards.",
    "didYouKnow": "Some locks are voluntary, while others are enforced automatically by smart-contract code.",
    "commonMistake": "Locking funds without checking the unlock date and exit rules. Market conditions can change while the assets remain inaccessible.",
    "quickChallenge": {
      "id": "crypto.lock.liquidity",
      "type": "identify_common_mistake",
      "prompt": "Which action is the biggest mistake before locking tokens for a year?",
      "options": [
        "Ignoring whether you may need the money sooner",
        "Reading the unlock rules",
        "Checking the protocol's risks"
      ],
      "correctAnswer": 0,
      "explanation": "Locked assets may be unavailable during emergencies, so liquidity needs must be considered first.",
      "difficulty": "beginner",
      "relatedTermId": "crypto.stake"
    },
    "relatedTermIds": [
      "crypto.stake",
      "crypto.vault",
      "crypto.token"
    ],
    "xpValue": 8,
    "reviewWeight": 1
  },
  {
    "id": "crypto.block",
    "word": "BLOCK",
    "normalizedWord": "block",
    "world": "crypto",
    "category": "network_infrastructure",
    "difficulty": "beginner",
    "definition": "A verified batch of transactions added as one new record in a blockchain's history.",
    "pronunciation": "BLOK",
    "realLifeExample": "Several transfers made around the same time may be grouped into one block before that block is linked to the chain.",
    "didYouKnow": "Block size and timing affect how many transactions a network can process and how quickly they are confirmed.",
    "commonMistake": "Thinking one block contains only one transaction. A block usually holds many transactions plus information linking it to earlier blocks.",
    "quickChallenge": {
      "id": "crypto.block.order",
      "type": "scenario_choice",
      "prompt": "Why are blocks linked in order?",
      "options": [
        "To make the transaction history difficult to alter unnoticed",
        "To guarantee every asset rises in price",
        "To hide all transactions from network participants"
      ],
      "correctAnswer": 0,
      "explanation": "Each block references earlier data, so changing old records would break the later links and become detectable.",
      "difficulty": "beginner",
      "relatedTermId": "crypto.chain"
    },
    "relatedTermIds": [
      "crypto.chain",
      "crypto.hash",
      "crypto.node"
    ],
    "xpValue": 10,